{
  "schema_version": "v1",
  "artifact_id": "PE-DA-REGULATED-TRANSFER-VNEXT",
  "artifact_version": "vNext",
  "analysis_status": "candidate",
  "policy_action": "candidate_handoff",
  "approved_policy_ref": "DA-CANDIDATE-POLICY-REGULATED-TRANSFER-VNEXT",
  "execution_request_ref": "APPROVED_TRANSACTION_RUNTIME_INPUT",
  "policy_rule_refs": [
    {
      "ref_id": "OR-DA-001",
      "ref_type": "outbound_requirement",
      "version": "vNext"
    },
    {
      "ref_id": "OR-DA-002",
      "ref_type": "outbound_requirement",
      "version": "vNext"
    },
    {
      "ref_id": "OR-DA-003",
      "ref_type": "outbound_requirement",
      "version": "vNext"
    },
    {
      "ref_id": "OR-DA-004",
      "ref_type": "outbound_requirement",
      "version": "vNext"
    },
    {
      "ref_id": "OR-DA-005",
      "ref_type": "outbound_requirement",
      "version": "vNext"
    },
    {
      "ref_id": "OR-DA-006",
      "ref_type": "outbound_requirement",
      "version": "vNext"
    },
    {
      "ref_id": "OR-DA-007",
      "ref_type": "outbound_requirement",
      "version": "vNext"
    },
    {
      "ref_id": "OR-DA-008",
      "ref_type": "outbound_requirement",
      "version": "vNext"
    },
    {
      "ref_id": "OR-DA-009",
      "ref_type": "outbound_requirement",
      "version": "vNext"
    },
    {
      "ref_id": "OR-DA-010",
      "ref_type": "outbound_requirement",
      "version": "vNext"
    },
    {
      "ref_id": "OR-DA-011",
      "ref_type": "outbound_requirement",
      "version": "vNext"
    },
    {
      "ref_id": "OR-DA-012",
      "ref_type": "outbound_requirement",
      "version": "vNext"
    },
    {
      "ref_id": "OR-DA-013",
      "ref_type": "outbound_requirement",
      "version": "vNext"
    },
    {
      "ref_id": "OR-DA-014",
      "ref_type": "outbound_requirement",
      "version": "vNext"
    },
    {
      "ref_id": "OR-DA-015",
      "ref_type": "outbound_requirement",
      "version": "vNext"
    },
    {
      "ref_id": "OR-DA-016",
      "ref_type": "outbound_requirement",
      "version": "vNext"
    },
    {
      "ref_id": "OR-DA-017",
      "ref_type": "outbound_requirement",
      "version": "vNext"
    },
    {
      "ref_id": "OR-DA-018",
      "ref_type": "outbound_requirement",
      "version": "vNext"
    }
  ],
  "required_input_fields": [
    "amount",
    "asset",
    "beneficiary_address",
    "beneficiary_identity",
    "counterparty_vasp",
    "kyc_status",
    "originator_address",
    "originator_identity",
    "transaction_id"
  ],
  "decision_values": [
    "PASS",
    "BLOCK",
    "REVIEW"
  ],
  "handoff_chain": [
    "Approved Transaction",
    "FPG",
    "Regulatory Outbound Requirement Enforcement",
    "Destination-specific Payload",
    "External Execution System",
    "Execution Result Binding",
    "Audit / Reconciliation Trace"
  ],
  "limitations": [
    "This Policy Evaluation artifact is an Outbound Handoff Evaluation, not transaction approval evaluation.",
    "KYC/AML/VASP eligibility/risk/sanctions decisions are upstream or external responsibilities.",
    "Synthetic policy simulations are not used as BE runtime control evidence.",
    "BE-owned runtime enums and provider payload schemas remain CONTRACT_GAP."
  ],
  "digest": {
    "algorithm": "sha256",
    "value": "b8d8f65eada4ed4c70be2c4b0c3f5f853344739785fa076861a0425cb65d4337"
  }
}
